{
  "schema_version": 1,
  "track": "real_world",
  "corpus_status": "candidate_registry_not_admitted",
  "ground_truth_policy": {
    "definition": "A real-world case is admitted only after independent incident evidence, immutable source/version provenance, affected-location mapping, and reviewer adjudication are recorded.",
    "independence": "Neither SolidityAnalyzer output nor LLM output may create, modify, or confirm Ground Truth by itself.",
    "quarantine_rule": "Ambiguous source versions, disputed root causes, or unmapped affected functions remain quarantined and are excluded from metrics."
  },
  "discovery_source": {
    "name": "DeFiHackLabs",
    "repository_url": "https://github.com/SunWeb3Sec/DeFiHackLabs",
    "repository_commit": "2c99b565ae24ea2006adf181da20c4419b3edc30",
    "role": "PoC and source-version discovery only; not sufficient as independent Ground Truth."
  },
  "cases": [
    {
      "id": "rw-001-parity-kill",
      "incident": "Parity multisig shared WalletLibrary selfdestruct freeze",
      "date": "2017-11",
      "families": ["access_control", "initialization", "selfdestruct"],
      "affected_functions": ["initWallet", "kill", "suicide"],
      "affected_function_confidence": "independent_postmortem_source_mapping_and_transaction",
      "source_path": "src/test/2017-11/Parity_kill_exp.sol",
      "source_repository_commit": "97df63d8a33c18e3e8c926879b1d05dc4de8286d",
      "source_sha256": "d19520035888d00275947fe1d0ab6e35f49d04341aba1d439ecab0d674ee636d",
      "attack_transaction": "0x47f7cff7a5e671884629c93b368cb18f58a993f4b19c2a53a8662e3f1482f690",
      "vulnerable_contract": "0x863df6bfa4469f3ead0be8f9f2aae51c91a907b4",
      "expected_detectors": ["Selfdestruct"],
      "status": "candidate_pending_selfdestruct_compatibility_and_second_adjudication",
      "references": [
        "https://medium.com/paritytech/a-postmortem-on-the-parity-multi-sig-library-self-destruct-63daca3a4cf7",
        "https://etherscan.io/address/0x863df6bfa4469f3ead0be8f9f2aae51c91a907b4#code",
        "https://etherscan.io/tx/0x47f7cff7a5e671884629c93b368cb18f58a993f4b19c2a53a8662e3f1482f690",
        "https://github.com/openethereum/parity-ethereum/issues/6995",
        "https://eips.ethereum.org/EIPS/eip-999"
      ],
      "notes": "Independent evidence and owned reproduction are complete. Taxonomy family coverage is Yes at the semantic level, but the exact deployed Solidity 0.4.x source uses legacy suicide(_to), the current analyzer is pinned to solc 0.8.25, and the comparator recognizes only selfdestruct(. The case remains quarantined because the existing detector did not confirm the exact source; no detector or architecture change is introduced.",
      "implementation_source": {
        "repository_url": "https://github.com/openethereum/parity-ethereum",
        "commit": "4d08e7b0aec46443bf26547b17d10cb302672835",
        "path": "js/src/contracts/snippets/enhanced-wallet.sol",
        "sha256": "5fe66d969af4d80ad50129cbb009fae6c4765da5828dfe7a53ad72b0f0ae29e0",
        "role": "upstream historical WalletLibrary lineage; exact deployed verified snapshot is separately pinned at benchmarks/real_world/source_snapshots/parity/WalletLibrary.sol",
        "line_ranges": ["WalletLibrary:64-461", "initWallet:216-219", "kill:222-224", "suicide(_to):223", "Wallet constructor delegatecall:417", "Wallet fallback delegatecall:429"]
      },
      "owned_reproduction": {
        "source_path": "benchmarks/real_world/owned_reproductions/parity/ParityWalletLibraryVulnerable.sol",
        "fixed_path": "benchmarks/real_world/owned_reproductions/parity/ParityWalletLibraryFixed.sol",
        "poc_path": "benchmarks/real_world/owned_reproductions/parity/parity_library_kill_poc.t.sol",
        "invariant_id": "parity.uninitialized_shared_library_cannot_be_destroyed",
        "status": "passed"
      },
      "adjudication_path": "benchmarks/real_world/adjudications/rw-001-parity-kill.json"
    },
    {
      "id": "rw-002-harvest-finance",
      "incident": "Harvest Finance price manipulation",
      "date": "2020-10",
      "families": ["price_manipulation", "oracle", "flash_loan"],
      "affected_functions": ["uniswapV2Call", "theSwap"],
      "affected_function_confidence": "reported_from_poc_structure",
      "source_path": "src/test/2020-10/HarvestFinance_exp.sol",
      "source_repository_commit": "4b55dffe3e9fd35099c95af728b4af58b75c6b2b",
      "source_sha256": "9a090685437a2537b2da8635facaf05de391204571769370df9df6b4e18f14f5",
      "attack_transaction": null,
      "vulnerable_contract": null,
      "expected_detectors": [],
      "status": "candidate_pending_external_incident_validation",
      "references": [],
      "notes": "The case is retained as a discovery candidate; the current analyzer has no dedicated price-manipulation detector, so no expected detector is assigned yet."
    },
    {
      "id": "rw-003-nomad-bridge",
      "incident": "Nomad Bridge empty-root initialization failure",
      "date": "2022-08",
      "families": ["access_control", "initialization", "bridge_message_validation"],
      "affected_functions": ["process"],
      "affected_function_confidence": "independent_report_and_poc",
      "source_path": "src/test/2022-08/NomadBridge_exp.sol",
      "source_repository_commit": "2baf1a43c44d6cb3ce17a678701784fbe7edabad",
      "source_sha256": "6d18e0ae0f31569b695279bd4f1cf5d1a46ee3385e9a720dec12b2f354c9121b",
      "attack_transaction": "0xa5fe9d044e4f3e5aa5bc4c0709333cd2190cba0f4e7f16bcf73f49f83e4a5460",
      "vulnerable_contract": "0xb92336759618f55bd0f8313bd843604592e27bd8",
      "expected_detectors": [],
      "status": "candidate_pending_source_snapshot_and_adjudication",
      "references": [
        "https://medium.com/nomad-xyz-blog/nomad-bridge-hack-root-cause-analysis-875ad2e5aacd",
        "https://www.certik.com/resources/blog/28fMavD63CpZJOKOjb9DX3-nomad-bridge-exploit-incident-analysis",
        "https://github.com/nomad-xyz/docs/blob/1ff0c55dba2a842c811468c57793ff9a6542ef0f/docs/public/Nomad-Audit.pdf"
      ],
      "implementation_source": {
        "repository_url": "https://github.com/nomad-xyz/monorepo",
        "commit": "7510d54a5cd334d283d84fdff59827abfceb2da7",
        "path": "packages/contracts-core/contracts/Replica.sol",
        "sha256": "3b6439fe258ffeeec58586e6d21ae3286903409b10b28f46b4b8cb64b4a773d6",
        "role": "official historical implementation source",
        "line_ranges": ["initialize:103-116", "proveAndProcess:162-172", "process:186-207", "acceptableRoot:262-273"]
      },
      "owned_reproduction": {
        "source_path": "benchmarks/real_world/owned_reproductions/nomad/NomadReplicaVulnerable.sol",
        "fixed_path": "benchmarks/real_world/owned_reproductions/nomad/NomadReplicaFixed.sol",
        "poc_path": "benchmarks/real_world/owned_reproductions/nomad/nomad_zero_root_poc.t.sol",
        "invariant_id": "nomad.zero_root_not_accepted",
        "status": "passed"
      },
      "adjudication_path": "benchmarks/real_world/adjudications/rw-003-nomad-bridge.json"
    },
    {
      "id": "rw-004-bonqdao",
      "incident": "BonqDAO Tellor price manipulation",
      "date": "2023-02",
      "families": ["oracle", "price_manipulation", "accounting"],
      "affected_functions": ["submitValue", "getCurrentValue", "price", "borrow", "liquidate"],
      "affected_function_confidence": "independent_reports_source_mapping_and_transactions",
      "source_path": "src/test/2023-02/BonqDAO_exp.sol",
      "source_repository_commit": "2baf1a43c44d6cb3ce17a678701784fbe7edabad",
      "source_sha256": "1b16549a68b78baa830af0c28dd922a1c0c2a9ff5d82556a93318ded825df30a",
      "attack_transactions": [
        "0x31957ecc43774d19f54d9968e95c69c882468b46860f921668f2c55fadd51b19",
        "0xa02d0c3d16d6ee0e0b6a42c3cc91997c2b40c87d777136dedebe8ee0f47f32b1"
      ],
      "vulnerable_contract": "0x8f55d884cad66b79e1a131f6bcb0e66f4fd84d5b",
      "expected_detectors": [],
      "status": "candidate_pending_oracle_detector_and_second_adjudication",
      "references": [
        "https://polygonscan.com/address/0xa1620af6138d2754f7250299dc9024563bd1a5d6#code",
        "https://polygonscan.com/address/0x8f55d884cad66b79e1a131f6bcb0e66f4fd84d5b#code",
        "https://medium.com/@omniscia.io/bonq-protocol-incident-post-mortem-4fd79fe5c932",
        "https://immunefi.com/blog/bug-fix-reviews/hack-analysis-bonqdao-february-2023/",
        "https://rekt.news/bonq-rekt",
        "https://medium.com/think-and-dev/the-bonq-dao-attack-d197d13cddd0",
        "https://www.numencyber.com/bonqdao-price-manipulation-attack-analysis-with-poc/"
      ],
      "implementation_source": {
        "repository_url": "https://github.com/tellor-io/tellorFlex",
        "commit": "3b3820f2111ec2813cb51455ef68cf0955c51674",
        "path": "contracts/TellorFlex.sol",
        "sha256": "db633e4080e3e95410e0eec34b17fbacaadca42281bbde5dd6282f61cd40a522",
        "role": "historical upstream TellorFlex implementation used by the verified Polygon oracle; Bonq TellorPriceFeed consumer is exact-match verified on PolygonScan",
        "line_ranges": ["submitValue:282-345", "getCurrentValue:419-427", "getDataBefore:437-454", "isInDispute:820-839"]
      },
      "owned_reproduction": {
        "source_path": "benchmarks/real_world/owned_reproductions/bonqdao/BonqTellorVulnerable.sol",
        "fixed_path": "benchmarks/real_world/owned_reproductions/bonqdao/BonqTellorFixed.sol",
        "poc_path": "benchmarks/real_world/owned_reproductions/bonqdao/bonqdao_dispute_window_poc.t.sol",
        "invariant_id": "bonq.oracle_price_requires_dispute_window",
        "status": "passed"
      },
      "adjudication_path": "benchmarks/real_world/adjudications/rw-004-bonqdao.json"
    },
    {
      "id": "rw-005-euler",
      "incident": "Euler Finance donate-to-reserves and liquidation sequence",
      "date": "2023-03",